{
  "foreverVersion": "0.1",
  "id": "constraint.portable",
  "kind": "constraint",
  "statement": "Run without a mandatory vendor service.",
  "category": "portability",
  "scope": [
    "intent.remote-transfer"
  ],
  "classification": "hard",
  "verification": [],
  "rationale": "Avoid vendor lock-in.",
  "provenance": {
    "sourceType": "explicit",
    "sourceReference": "project author",
    "confidence": 1,
    "reviewStatus": "accepted"
  }
}
